{
  "format": "brickpro-settings-registry",
  "schemaVersion": 1,
  "allowedNamespaces": ["core", "provider.scraper"],
  "sections": [
    {"id": "display", "labelKey": "settings.display.label", "descriptionKey": "settings.display.description", "order": 10},
    {"id": "audio", "labelKey": "settings.audio.label", "descriptionKey": "settings.audio.description", "order": 20},
    {"id": "input", "labelKey": "settings.input.label", "descriptionKey": "settings.input.description", "order": 30},
    {"id": "scraper", "labelKey": "settings.scraper.label", "descriptionKey": "settings.scraper.description", "order": 40},
    {"id": "theme", "labelKey": "settings.theme.label", "descriptionKey": "settings.theme.description", "order": 50},
    {"id": "system", "labelKey": "settings.system.label", "descriptionKey": "settings.system.description", "order": 60},
    {"id": "network", "labelKey": "settings.network.label", "descriptionKey": "settings.network.description", "order": 70},
    {"id": "wifi", "labelKey": "settings.wifi.label", "descriptionKey": "settings.wifi.description", "order": 80},
    {"id": "power", "labelKey": "settings.power.label", "descriptionKey": "settings.power.description", "order": 90}
  ],
  "settings": [
    {
      "id": "core.display.brightness", "namespace": "core", "section": "display", "group": "screen", "order": 10,
      "labelKey": "settings.display.brightness.label", "descriptionKey": "settings.display.brightness.description", "kind": "integer",
      "default": {"kind": "integer", "value": 50}, "current": {"kind": "integer", "value": 60}, "pending": {"kind": "integer", "value": 70},
      "constraints": {"range": {"min": 0, "max": 100, "step": 10}, "text": null, "options": []},
      "units": "percent", "display": {"unit": "percent", "format": "slider", "redact": false}, "scope": "system", "apply": ["immediate"],
      "requiresCapabilities": [], "unsupportedReason": null, "visibility": null, "enabledIf": null, "redacted": false,
      "validation": {"required": true, "trim": false, "allowEmpty": false}, "migration": null
    },
    {
      "id": "core.display.ui-size", "namespace": "core", "section": "display", "group": "screen", "order": 40,
      "labelKey": "settings.display.uiSize.label", "descriptionKey": "settings.display.uiSize.description", "kind": "enum-single",
      "default": {"kind": "enum-single", "value": "automatic"}, "current": {"kind": "enum-single", "value": "automatic"}, "pending": null,
      "constraints": {"range": null, "text": null, "options": [
        {"value": "automatic", "labelKey": "settings.display.uiSize.automatic"},
        {"value": "compact", "labelKey": "settings.display.uiSize.compact"},
        {"value": "comfortable", "labelKey": "settings.display.uiSize.comfortable"},
        {"value": "large", "labelKey": "settings.display.uiSize.large"},
        {"value": "extra-large", "labelKey": "settings.display.uiSize.extraLarge"}
      ]},
      "units": null, "display": {"unit": null, "format": "select", "redact": false}, "scope": "user", "apply": ["on-confirm"],
      "requiresCapabilities": [], "unsupportedReason": null, "visibility": null, "enabledIf": null, "redacted": false,
      "validation": {"required": true, "trim": false, "allowEmpty": false}, "migration": null
    },
    {
      "id": "core.display.gamma", "namespace": "core", "section": "display", "group": "screen", "order": 20,
      "labelKey": "settings.display.gamma.label", "descriptionKey": "settings.display.gamma.description", "kind": "decimal",
      "default": {"kind": "decimal", "value": 1.0}, "current": {"kind": "decimal", "value": 1.2}, "pending": null,
      "constraints": {"range": {"min": 0.5, "max": 2.0, "step": 0.1}, "text": null, "options": []},
      "units": null, "display": {"unit": null, "format": "decimal", "redact": false}, "scope": "user", "apply": ["on-confirm"],
      "requiresCapabilities": [], "unsupportedReason": null, "visibility": null, "enabledIf": null, "redacted": false,
      "validation": {"required": true, "trim": false, "allowEmpty": false}, "migration": null
    },
    {
      "id": "core.display.night-mode", "namespace": "core", "section": "display", "group": "screen", "order": 30,
      "labelKey": "settings.display.nightMode.label", "descriptionKey": "settings.display.nightMode.description", "kind": "boolean",
      "default": {"kind": "boolean", "value": false}, "current": {"kind": "boolean", "value": true}, "pending": null,
      "constraints": null, "units": null, "display": {"unit": null, "format": "toggle", "redact": false}, "scope": "theme", "apply": ["restart-launcher"],
      "requiresCapabilities": [], "unsupportedReason": null, "visibility": null, "enabledIf": null, "redacted": false,
      "validation": {"required": true, "trim": false, "allowEmpty": false}, "migration": null
    },
    {
      "id": "core.audio.volume", "namespace": "core", "section": "audio", "group": "output", "order": 10,
      "labelKey": "settings.audio.volume.label", "descriptionKey": "settings.audio.volume.description", "kind": "integer",
      "default": {"kind": "integer", "value": 70}, "current": {"kind": "integer", "value": 70}, "pending": null,
      "constraints": {"range": {"min": 0, "max": 100, "step": 5}, "text": null, "options": []},
      "units": "percent", "display": {"unit": "percent", "format": "slider", "redact": false}, "scope": "core", "apply": ["reboot-candidate"],
      "requiresCapabilities": [], "unsupportedReason": null, "visibility": null, "enabledIf": null, "redacted": false,
      "validation": {"required": true, "trim": false, "allowEmpty": false}, "migration": null
    },
    {
      "id": "core.audio.output", "namespace": "core", "section": "audio", "group": "output", "order": 20,
      "labelKey": "settings.audio.output.label", "descriptionKey": "settings.audio.output.description", "kind": "enum-single",
      "default": {"kind": "enum-single", "value": "speaker"}, "current": {"kind": "enum-single", "value": "headphones"}, "pending": null,
      "constraints": {"range": null, "text": null, "options": [
        {"value": "speaker", "labelKey": "settings.audio.output.speaker"},
        {"value": "headphones", "labelKey": "settings.audio.output.headphones"}
      ]},
      "units": null, "display": {"unit": null, "format": "select", "redact": false}, "scope": "system", "apply": ["on-confirm"],
      "requiresCapabilities": ["audio"], "unsupportedReason": "Audio output is unavailable on this platform", "visibility": null, "enabledIf": null, "redacted": false,
      "validation": {"required": true, "trim": false, "allowEmpty": false}, "migration": null
    },
    {
      "id": "core.input.hotkey", "namespace": "core", "section": "input", "group": "shortcuts", "order": 10,
      "labelKey": "settings.input.hotkey.label", "descriptionKey": "settings.input.hotkey.description", "kind": "text",
      "default": {"kind": "text", "value": "menu"}, "current": {"kind": "text", "value": "menu"}, "pending": null,
      "constraints": {"range": null, "text": {"minLength": 1, "maxLength": 16, "pattern": "^[A-Za-z0-9_-]+$"}, "options": []},
      "units": null, "display": {"unit": null, "format": "text", "redact": false}, "scope": "emulator-profile", "apply": ["immediate"],
      "requiresCapabilities": [], "unsupportedReason": null, "visibility": null, "enabledIf": null, "redacted": false,
      "validation": {"required": true, "trim": true, "allowEmpty": false}, "migration": null
    },
    {
      "id": "core.input.turbo-buttons", "namespace": "core", "section": "input", "group": "shortcuts", "order": 20,
      "labelKey": "settings.input.turboButtons.label", "descriptionKey": "settings.input.turboButtons.description", "kind": "enum-multi",
      "default": {"kind": "enum-multi", "value": ["a"]}, "current": {"kind": "enum-multi", "value": ["a", "b"]}, "pending": null,
      "constraints": {"range": null, "text": null, "options": [
        {"value": "a", "labelKey": "settings.button.a"}, {"value": "b", "labelKey": "settings.button.b"}, {"value": "x", "labelKey": "settings.button.x"}
      ]},
      "units": null, "display": {"unit": null, "format": "multi-select", "redact": false}, "scope": "game", "apply": ["on-confirm"],
      "requiresCapabilities": [], "unsupportedReason": null, "visibility": null, "enabledIf": null, "redacted": false,
      "validation": {"required": false, "trim": false, "allowEmpty": true}, "migration": null
    },
    {
      "id": "provider.scraper.api-key", "namespace": "provider.scraper", "section": "scraper", "group": "credentials", "order": 10,
      "labelKey": "settings.scraper.apiKey.label", "descriptionKey": "settings.scraper.apiKey.description", "kind": "secret",
      "default": null, "current": null, "pending": null,
      "constraints": null, "units": null, "display": {"unit": null, "format": "password", "redact": true}, "scope": "provider", "apply": ["external-operation"],
      "requiresCapabilities": ["network"], "unsupportedReason": "Scraper credentials require network support", "visibility": null, "enabledIf": null, "redacted": true,
      "validation": {"required": false, "trim": true, "allowEmpty": true}, "migration": {"key": "scraper.api-key", "introducedIn": 1, "removedIn": null}
    },
    {
      "id": "core.theme.style", "namespace": "core", "section": "theme", "group": "appearance", "order": 10,
      "labelKey": "settings.theme.style.label", "descriptionKey": "settings.theme.style.description", "kind": "enum-single",
      "default": {"kind": "enum-single", "value": "brick"}, "current": {"kind": "enum-single", "value": "brick"}, "pending": null,
      "constraints": {"range": null, "text": null, "options": [
        {"value": "brick", "labelKey": "settings.theme.style.brick"}, {"value": "dark", "labelKey": "settings.theme.style.dark"}
      ]},
      "units": null, "display": {"unit": null, "format": "select", "redact": false}, "scope": "theme", "apply": ["restart-launcher"],